original,simplified
"Die Zulassungsbehörde teilt dem Fahrzeug ein Kennzeichen zu, wobei Sie die Möglichkeit haben, eigene Wünsche zum Kennzeichen zu äußern.","Jedes Fahrzeug in Deutschland muss ein Kenn-Zeichen haben, damit es auf der Straße fahren darf. Ein Kenn-Zeichen ist ein Schild mit Zahlen und Buchstaben . Die Zulassungs-Stelle teilt Ihrem Fahrzeug das Kenn-Zeichen zu. Sie können sich dabei auch Buchstaben und Zahlen wünschen. Das schwere Wort dafür ist: Wunsch-Kenn-Zeichen ."
"Bitte beachten Sie, dass kein Rechtsanspruch auf die Zuteilung eines bestimmten Kennzeichens besteht.",Bitte beachten Sie: Wir versuchen Ihre Wünsche beim Kenn-Zeichen zu beachten. Aber wir können nicht alle Wünsche erfüllen. Sie haben keinen Anspruch auf ein bestimmtes Kenn-Zeichen.
Für Ihr Wunschkennzeichen nutzen Sie bitte das online-Angebot.,Sie können Ihr Wunsch-Kenn-Zeichen online aussuchen. Online heißt: Sie können am Computer ein Kenn-Zeichen aussuchen.
Ihr online reserviertes Kennzeichen ist 90 Tage für Sie reserviert.,Wir reservieren dann Ihr Wunsch-Kenn-Zeichen für 180 Tage .
Mit der Reservierungs-Bestätigung können Sie die neuen Nummernschilder vorab kaufen und diese für die Fahrt zur Kfz-Zulassungsstelle nutzen.,"3. Wenn Sie Ihr Kenn-Zeichen bei uns reserviert haben, dann können Sie sich ein Schild für Ihr Kenn-Zeichen kaufen. Das Schild können Sie nicht bei uns kaufen. Das Schild für das Kenn-Zeichen bekommen Sie nur bei Schilder-Herstellern. Wichtig: Sie können das Schild nur mit einer Reservierungs-Bestätigung kaufen."
"Mit den neuen Nummernschildern dürfen Sie nur innerhalb des Zulassungsbezirks Köln (K) oder aus den Zulassungsbezirken Erftkreis (BM), Rhein-Sieg-Kreis (SU), Rheinisch Bergischer Kreis (GL), Leverkusen (LEV) und Kreis Neuss (NE) fahren.","Achtung: Wenn Ihr Kenn-Zeichen noch nicht zugelassen ist, dürfen Sie nur innerhalb vom Zulassungs-Bezirk Köln (K) zu uns fahren. Oder aus diesen Zulassungs-Bezirken: Erft-Kreis (BM), Rhein-Sieg-Kreis (SU), Rheinisch Bergischer Kreis (GL), Leverkusen (LEV) Kreis Mettmann (ME) und Kreis Neuss (NE)."
Die Fahrten müssen von Ihrer Kraftfahrzeug-Haftpflichtversicherung erfasst und Ihnen eine elektronische Versicherungsbestätigungs-Nummer (eVB-Nummer) zugeteilt worden sein.,Sie müssen die Fahrten ohne zugelassenes Kenn-Zeichen anmelden bei Ihrer Kraft-Fahrzeug-Haft-Pflicht-Versicherung. Von Ihrer Versicherung bekommen Sie eine Bestätigungs-Nummer. Die Abkürzung dafür ist: eVB-Nummer. Die eVB-Nummer ist wichtig.
"Diese eVB-Nummer müssen Sie anlässlich ordnungsbehördlicher Kontrollen angeben können, damit die Ordnungskräfte in der Lage sind, die Zulässigkeit der Fahrt mit den noch nicht gesiegelten Kennzeichen festzustellen.",Zum Beispiel: Wenn die Polizei Sie kontrolliert. Dann müssen Sie der Polizei die eVB-Nummer sagen. Damit die Polizei prüfen kann: Ob Sie mit dem Kenn-Zeichen ohne Stempel fahren dürfen.
Für andere Fahrten dürfen Sie diese Kennzeichen nicht benutzen!,Für andere Fahrten dürfen Sie Kenn-Zeichen ohne Stempel nicht benutzen!
"Für Ihr Kennzeichen können Sie Buchstaben und Zahlen jeder beliebigen Kombination zusammenstellen, die momentan noch frei ist.",Für Ihr Kenn-Zeichen können Sie selbst Buchstaben und Zahlen aussuchen. Wichtig: Kenn-Zeichen für Autos müssen 2 bis 6 Zeichen haben.
"Kennzeichenkombinationen bestehen aus mindestens 2 und maximal 6 Zeichen, wobei das ""K"" nicht mitgerechnet wird.",Der Buchstabe K für Köln wird dabei nicht mitgezählt.
"Für Ihr Motorrad gibt es spezielle Motorradkennzeichen, mit mindestens 2 und maximal 5 Zeichen, wobei auch hier das ""K"" nicht mitgerechnet wird.",Kenn-Zeichen für Motor-Räder müssen 2 bis 5 Zeichen haben.
"Ausgenommen von einer Zuteilung sind die unzulässigen Buchstaben-Kombinationen HJ, KZ, NS, SA, SS und ZZ und der Einzelbuchstabe Z.","Manche Kenn-Zeichen sind in Deutschland verboten. Verboten sind Kenn-Zeichen mit den Buchstaben: HJ, KZ, NS, SA, SS, ZZ und der einzelne Buchstabe Z . Zum Beispiel: K-Z 1."
"Die Kennzeichen K-TX 1 bis K-TX 9999 werden nur für Taxen ausgegeben, die Kennzeichen K-LN 1 bis K-LN 9999 sind für Fahrzeuge der Stadtverwaltung Köln vorgesehen.",Die Kenn-Zeichen mit den Buchstaben TX sind nur für Taxis . Zum Beispiel: K-TX 1. Diese Kenn-Zeichen dürfen Sie nicht benutzen .
"Die Zuteilung eines Wunschkennzeichens kostet 10,20 Euro.","Wie viel kostet ein Wunsch-Kenn-Zeichen? Ein Wunsch-Kenn-Zeichen kostet 10,20 Euro ."
"Wenn Sie das Kennzeichen vorab online oder telefonisch reservieren, kommen 2,60 Euro dazu, insgesamt sind das also 12,80 Euro.","Wenn Sie das Kenn-Zeichen im Internet oder am Telefon reservieren, dann müssen Sie zusätzlich 2,60 Euro bezahlen. Das heißt: Sie müssen dann insgesamt 12,80 Euro bezahlen."
Sie können diese Gebühr zusammen mit den anderen Gebühren für die Zulassung bei uns vor Ort in der Zulassungsstelle oder im Kundenzentrum Innenstadt bezahlen.,Sie müssen beim Zulassen direkt bezahlen. Das heißt: Sie bezahlen in der Zulassungs-Stelle oder im Kunden-Zentrum Innenstadt. Sie können mit Bar-Geld bezahlen. Das heißt: Sie können mit Geld-Scheinen und Münzen bezahlen. Oder Sie können auch mit Ihrer EC-Karte bezahlen. Eine EC-Karte ist eine Karte aus Plastik.
Bei einer erneuten Zuteilung dieses Kennzeichens für ein anderes Fahrzeug derselben Halterin oder desselben Halters werden wiederum die Gebühren für ein Wunschkennzeichen fällig.,Aber Sie müssen weitere Gebühren für das Kenn-Zeichen bezahlen: Wenn Sie das Kenn-Zeichen für ein anderes Fahrzeug brauchen.
"Wenn es sich jedoch um die erneute Zuteilung des Kennzeichens für dasselbe Fahrzeug auf dieselbe Halterin oder denselben Halter handelt, müssen Sie keine Gebühren für das Wunschkennzeichen bezahlen.",Wichtig: Sie müssen keine weiteren Gebühren für das Kenn-Zeichen bezahlen: Wenn Sie das Kenn-Zeichen noch einmal brauchen für das selbe Fahrzeug mit dem selben Halter oder der selben Halterin .
