original,simplified
"Wer ein Kind mit Behinderung erwartet, hat oft viele Fragen.",Rund um das Thema Behinderung haben viele Menschen Fragen.
Die Lebenshilfe Main-Taunus steht den Menschen mit Behinderung und ihren Familien in allen Lebensphasen mit Rat und Tat zur Seite.,Zum Beispiel: Die Lebenshilfe steht den Menschen mit Behinderung und ihren Familien gerne mit Rat und Tat zur Seite. Wir haben Angebote für jedes Alter.
"Unsere Angebote richten sich an Familien mit Babys, Kleinkindern, Schulkindern, Jugendlichen und Erwachsenen.",Unsere Angebote richten sich an:
"Unsere Fachkräfte beraten, informieren, fördern, begleiten und unterstützen Sie gerne.",Wir beraten und unterstützen Sie gerne.
"Sprechen Sie uns an, wir freuen uns auf Sie!",Sprechen Sie uns an. Wir freuen uns auf Sie!
